{
  "conformsTo": "pic-traces/0.1.0",
  "caseId": "nz-oia/fixture.transfer_deadline_after_anzac_mondayisation",
  "packageRef": {
    "id": "nz-oia-clocks",
    "version": "0.1.0"
  },
  "engine": {
    "name": "foi-o-nz",
    "version": "0.9.0",
    "adapter": "oia_rules"
  },
  "timestamp": "2026-07-05T17:28:23.786443Z",
  "inputs": {
    "nz-oia/variable.receipt_date": {
      "valueState": "known",
      "value": "2026-04-24"
    },
    "nz-oia/variable.transfer_notice_date": {
      "valueState": "known",
      "value": "2026-05-11"
    }
  },
  "outputs": {
    "nz-oia/decision.transfer_deadline": {
      "valueState": "known",
      "value": "2026-05-11"
    }
  },
  "steps": [
    {
      "stepId": "transfer_deadline",
      "kind": "decision",
      "inputsUsed": [
        "nz-oia/variable.receipt_date"
      ],
      "parameterVersions": [
        {
          "id": "nz-oia/parameter.transfer_limit",
          "effectiveFrom": "2025-04-05"
        }
      ],
      "result": {
        "value": "2026-05-11",
        "valueState": "known"
      },
      "sourceRefs": [
        "OIA 1982 s 2",
        "OIA 1982 s 14"
      ],
      "refs": {
        "decision": "nz-oia/decision.transfer_deadline"
      }
    }
  ]
}