{
  "conformsTo": "pic-traces/0.1.0",
  "caseId": "nz-oia/fixture.extension_consultation_ground",
  "packageRef": {
    "id": "nz-oia-clocks",
    "version": "0.1.0"
  },
  "engine": {
    "name": "foi-o-nz",
    "version": "0.9.0",
    "adapter": "oia_rules"
  },
  "timestamp": "2026-07-05T17:28:23.786443Z",
  "inputs": {
    "nz-oia/variable.receipt_date": {
      "valueState": "known",
      "value": "2026-07-09"
    },
    "nz-oia/variable.extension_notice_date": {
      "valueState": "known",
      "value": "2026-08-06"
    },
    "nz-oia/variable.extension_ground": {
      "valueState": "known",
      "value": "consultation_required"
    },
    "nz-oia/variable.extension_period_working_days": {
      "valueState": "known",
      "value": 15
    }
  },
  "outputs": {
    "nz-oia/decision.extension_validity": {
      "valueState": "known",
      "value": true,
      "warnings": [
        "extension period reasonableness requires human review"
      ]
    }
  },
  "steps": [
    {
      "stepId": "extension_validity",
      "kind": "decision",
      "inputsUsed": [
        "nz-oia/variable.receipt_date",
        "nz-oia/variable.extension_notice_date",
        "nz-oia/variable.extension_ground",
        "nz-oia/variable.extension_period_working_days"
      ],
      "parameterVersions": [],
      "result": {
        "value": true,
        "valueState": "known",
        "warnings": [
          "extension period reasonableness requires human review"
        ]
      },
      "sourceRefs": [
        "OIA 1982 s 15",
        "OIA 1982 s 15A"
      ],
      "refs": {
        "decision": "nz-oia/decision.extension_validity"
      }
    }
  ]
}