{
  "conformsTo": "pic-traces/0.1.0",
  "caseId": "nz-oia/fixture.simple_response_deadline",
  "packageRef": {"id": "nz-oia-clocks", "version": "0.1.0"},
  "engine": {"name": "pic-example", "version": "0.1.0", "adapter": "manual-sample"},
  "timestamp": "2026-07-05T00:00:00Z",
  "inputs": {
    "nz-oia/variable.receipt_date": {"value": "2026-01-12", "valueState": "known"}
  },
  "outputs": {
    "nz-oia/decision.response_deadline": {"value": "2026-02-10", "valueState": "known"}
  },
  "steps": [
    {
      "stepId": "response_deadline",
      "kind": "decision",
      "refs": {"decision": "nz-oia/decision.response_deadline"},
      "inputsUsed": ["nz-oia/variable.receipt_date"],
      "parameterVersions": [
        {"id": "nz-oia/parameter.working_day_limit", "effectiveFrom": "1987-04-01"}
      ],
      "result": {"value": "2026-02-10", "valueState": "known"},
      "sourceRefs": ["Official Information Act 1982 s 15"]
    }
  ]
}

